headline,date,doc_type,material_type,section,keywords
Your Monday Briefing: U.S. Senate Passes Major Legislation,2022-08-07,article,briefing,,"['Politics and Government', 'Law and Legislation', 'United States Politics and Government', 'War and Armed Conflicts']"
The Way I See It,2022-08-07,article,News,,['Crossword Puzzles']
Israel and Palestinian Militants Reach a Cease-Fire,2022-08-07,article,News,,"['Palestinians', 'War and Armed Conflicts', 'Terrorism', 'Deaths (Fatalities)']"
Yankees Show Flaws and Get a First Look at Frankie Montas,2022-08-07,article,News,,['Baseball']
Killings of 4 Men in Albuquerque Leave Muslim Community in Fear,2022-08-07,article,News,,"['Muslims and Islam', 'Hate Crimes', 'Muslim Americans', 'Murders, Attempted Murders and Homicides']"
New Jersey Man Gets 5 Years in Prison in GoFundMe Fraud Case,2022-08-07,article,News,,"['Homeless Persons', 'Frauds and Swindling']"
Mets Strengthen Their N.L. East Lead,2022-08-08,multimedia,Interactive Feature,,['Baseball']
Ex-Officer to Serve Time for Failing to Act in Excessive Force Arrest,2022-08-08,article,News,,"['Police', 'Police Brutality, Misconduct and Shootings']"
‘Why Do I Have to Work Twice as Hard Just to Get Noticed?’,2022-08-08,article,News,,"['Basketball', 'Content Type: Personal Profile']"
"In My Homeland, the Smell of Death on a Summer Afternoon",2022-08-08,article,News,,"['Russian Invasion of Ukraine (2022)', 'Defense and Military Forces', 'Deaths (Fatalities)', 'Civilian Casualties']"
Quotation of the Day: Muslims in New Mexico Are Shaken by Possible Targeted Killings,2022-08-08,article,Quote,,[]
"No Corrections: Aug. 8, 2022",2022-08-08,article,News,,[]
Your Monday Briefing,2022-08-08,article,briefing,,[]
What’s on TV This Week: ‘The Princess’ and ‘Password’,2022-08-08,article,News,,"['Television', 'Movies']"
"For Ukrainians in Donbas, tragedy is the backdrop to everyday existence.",2022-08-08,article,News,,[]
Authorities Seek Public’s Help in Investigation of Albuquerque Killings,2022-08-08,multimedia,Video,,"['Muslims and Islam', 'Murders, Attempted Murders and Homicides']"
Why the Rent Is So High,2022-08-08,article,briefing,,"['Renting and Leasing (Real Estate)', 'Affordable Housing']"
Spelling Bee Forum,2022-08-08,article,News,,[]
"Along a Subway Line’s 31 Miles, Nagging Crime Fears Test Riders’ Resolve",2022-08-08,article,News,,"['Crime and Criminals', 'Subways', 'Murders, Attempted Murders and Homicides', 'Assaults']"
"In an Unequal Economy, the Poor Face Inflation Now and Job Loss Later",2022-08-08,article,News,,"['Income Inequality', 'United States Economy', 'Layoffs and Job Reductions', 'Wages and Salaries', 'Coronavirus (2019-nCoV)', 'Inflation (Economics)', 'Food Insecurity', 'Poverty', 'Interest Rates', 'audio-neutral-informative']"
The Heady Nihilism of Kotaro Isaka,2022-08-08,article,Review,,['Books and Literature']
"I Love My Students, but I Won’t Use a Gun to Protect Them",2022-08-08,article,Op-Ed,,"['Gun Control', 'Firearms', 'School Shootings and Armed Attacks', 'Teachers and School Employees', 'Uvalde, Tex, Shooting (May 24, 2022)', 'United States Politics and Government']"
"Exercise Was the Perfect Coping Mechanism, Until It Wasn’t",2022-08-08,article,Op-Ed,,"['Exercise', 'Rowing', 'Anxiety and Stress', 'Depression (Mental)', 'Sports Injuries']"
We Will All End Up Paying for Someone Else’s Beach House,2022-08-08,article,Op-Ed,,"['Real Estate and Housing (Residential)', 'Coast Erosion', 'Beaches', 'Hurricanes and Tropical Storms', 'Global Warming', 'Coastal Areas']"
Your Pandemic Puppy Was Not a Mistake,2022-08-08,article,News,,"['Pets', 'Dogs', 'Veterinary Medicine', 'Quarantine (Life and Culture)', 'Coronavirus (2019-nCoV)']"
"A Sparsely Populated Island, a Marital Spat and a Missing Husband",2022-08-08,article,News,,"['Books and Literature', 'genre-books-thriller', 'genre-books-mystery']"
"Bolsonaro Is Afraid of Going to Prison, and He’s Right to Be",2022-08-08,article,Op-Ed,,"['Elections', 'Corruption (Institutional)']"
Subverting a Preppy Classic,2022-08-08,article,News,,"['Handbags and Purses', 'Social Media', 'Generation Z', 'Millennial Generation']"
Mandela Barnes Is Already Looking Past Wisconsin’s Democratic Primary,2022-08-08,article,News,,"['Health Insurance and Managed Care', 'Midterm Elections (2022)', 'Elections, Senate']"
Shopping for Laundry Hampers,2022-08-08,article,News,,"['Real Estate and Housing (Residential)', 'Interior Design and Furnishings', 'Furniture', 'Design', 'Laundry and Laundromats', 'Content Type: Service']"
‘No Drama’ Compost? N.Y.C. Is Expanding Food and Yard Waste Pickup,2022-08-08,article,News,,"['Compost', 'Rats', 'Food', 'Global Warming', 'Waste Materials and Disposal', 'Sustainable Living', 'Politics and Government']"
U.S. Open Commits to Fund-Raising Exhibition Match and $2 Million for Ukraine,2022-08-08,article,News,,"['Russian Invasion of Ukraine (2022)', 'United States Open (Tennis)']"
"In Wisconsin, G.O.P. Voters Demand the Impossible: Decertifying 2020",2022-08-08,article,News,,"['Project Democracy', 'Elections, Governors', 'Primaries and Caucuses', 'Midterm Elections (2022)', 'Presidential Election of 2020', 'Voter Fraud (Election Fraud)', 'Rumors and Misinformation']"
Maps in Four States Were Ruled Illegal Gerrymanders. They’re Being Used Anyway.,2022-08-08,article,News,,"['Project Democracy', 'Elections, House of Representatives', 'Redistricting and Reapportionment', 'Supreme Courts (State)', 'Voting Rights, Registration and Requirements', 'Midterm Elections (2022)', 'Federal-State Relations (US)']"
Biden Appeared to Overstate the Role of Al Qaeda’s Leader,2022-08-08,article,News,,"['Terrorism', 'Cole (USS)', 'September 11 (2001)', 'United States Politics and Government', 'Targeted Killings']"
"Freed From Prison in China, Taiwan Activist Urges Resistance to Beijing’s Threats",2022-08-08,article,News,,"['International Relations', 'Prisons and Prisoners', 'Democracy (Theory and Philosophy)']"
The Taliban’s Dangerous Collision Course With the West,2022-08-08,article,News,,"['Afghanistan War (2001- )', ""Women's Rights"", 'Food Insecurity', 'Foreign Aid', 'Humanitarian Aid', 'International Relations', 'Terrorism']"
Can Global Shipping Be Fixed? One Regulator Will Try.,2022-08-08,article,News,,"['Ships and Shipping', 'Ports', 'Freight (Cargo)', 'Inflation (Economics)', 'Regulation and Deregulation of Industry', 'Content Type: Personal Profile', 'Prices (Fares, Fees and Rates)', 'International Trade and World Market', 'United States Politics and Government']"
‘What a Horrible Place This Would Have Been’,2022-08-08,article,News,,"['your-feed-science', 'Archaeology and Anthropology', 'Revolutionary War, American (1775-83)', 'Mercenaries and Private Military Contractors', 'Bones', 'DNA (Deoxyribonucleic Acid)', 'Historic Buildings and Sites']"
What You Get for $4 Million in California,2022-08-08,multimedia,Slideshow,,['Real Estate and Housing (Residential)']
$4 Million Homes in California,2022-08-08,article,News,,['Real Estate and Housing (Residential)']
"Embarrassing, Uncomfortable and Risky: What Flying Is Like for Passengers Who Use Wheelchairs",2022-08-08,article,News,,"['AIRLINES AND AIRPLANES', 'Wheelchairs', 'Airports', 'Airport Security', 'Luggage and Packing', 'Disabilities', 'audio-neutral-immersive']"
"China’s Military Drills and Other Tensions With Taiwan, Explained",2022-08-08,article,News,,"['International Relations', 'United States International Relations', 'Defense and Military Forces']"
The Alex Jones Verdict and the Fight Against Disinformation,2022-08-08,article,News,,"['Decisions and Verdicts', 'Rumors and Misinformation', 'Conspiracy Theories', 'Compensation for Damages (Law)', 'School Shootings and Armed Attacks', 'Children and Childhood', 'audio-neutral-informative', 'Newtown, Conn, Shooting (2012)']"
Rumors spread quickly in wartime Ukraine.,2022-08-08,article,News,,"['War and Armed Conflicts', 'Rumors and Misinformation', 'Russian Invasion of Ukraine (2022)', 'Politics and Government']"
A Drop in Murders,2022-08-08,article,briefing,,"['internal-storyline-no', 'Murders, Attempted Murders and Homicides', 'Deaths (Fatalities)', 'Polls and Public Opinion', 'Crime and Criminals']"
People Flock to South Korean Crypto Event Despite Market Turmoil,2022-08-08,article,News,,['Virtual Currency']
SoftBank Reports $23 Billion Loss as Tech Investments Plummet,2022-08-08,article,News,,"['Company Reports', 'Computers and the Internet', 'Stocks and Bonds']"
"Trump Asked Aide Why His Generals Couldn’t Be Like Hitler’s, Book Says",2022-08-08,article,News,,"['Books and Literature', 'United States Politics and Government', 'United States Defense and Military Forces', 'Storming of the US Capitol (Jan, 2021)', 'Presidential Election of 2020']"
"California Fire and Floods Turn a River to ‘Sludge,’ Killing Thousands of Fish",2022-08-08,article,News,,"['Wildfires', 'Deaths (Fatalities)', 'Fish and Other Marine Life', 'Floods', 'Fires and Firefighters', 'Water Pollution']"
A Cease-Fire Holds After a 3-Day Gaza Conflict: Key Takeaways,2022-08-08,article,News,,"['War and Armed Conflicts', 'Defense and Military Forces', 'Palestinians']"
Sacramento Savors Its Underdog Moment,2022-08-08,article,briefing,,[]
Fashion Suited for Surreal Times,2022-08-08,article,News,,['Fashion and Apparel']
"Rescuing Art in Ukraine with Foam, Crates and Cries for Help",2022-08-08,article,News,,"['Russian Invasion of Ukraine (2022)', 'Museums', 'Arts and Antiquities Looting', 'Art', 'Monuments and Memorials (Structures)', 'Historic Buildings and Sites']"
Axios Agrees to Sell Itself to Cox Enterprises for $525 Million,2022-08-08,article,News,,"['News and News Media', 'Mergers, Acquisitions and Divestitures']"
$15 French Fries and $18 Sandwiches: Inflation Hits New York,2022-08-08,article,News,,"['Food', 'Prices (Fares, Fees and Rates)', 'Restaurants', 'Inflation (Economics)']"
‘A Slow Death’: Egypt’s Political Prisoners Recount Horrific Conditions,2022-08-08,article,News,,"['Political Prisoners', 'Torture', 'Human Rights and Human Rights Violations', 'Politics and Government']"
Pete Rose Dismisses Questions About Sexual Misconduct,2022-08-08,article,News,,"['Baseball', 'Sex Crimes', 'Child Abuse and Neglect', 'Suits and Litigation (Civil)']"
What to Cook Right Now,2022-08-08,article,Letter,,"['Cooking and Cookbooks', 'Content Type: Service']"
Decorative Bowls for Odds and Ends,2022-08-08,article,News,,"['Interior Design and Furnishings', 'Tableware', 'Design', 'Ceramics and Pottery']"
The U.N. secretary general warns that attacks on the Zaporizhzhia nuclear complex could be ‘suicidal.’,2022-08-08,article,News,,"['Russian Invasion of Ukraine (2022)', 'Nuclear Energy']"
In Search of Mexican Pizza,2022-08-08,article,News,,"['Pizza', 'Restaurants', 'Mexican Food (Cuisine)', 'Mexican-Americans']"
Two in Arbery Case Sentenced Again to Life in Prison; Third Man Gets 35 Years,2022-08-08,article,News,,"['Hate Crimes', 'Murders, Attempted Murders and Homicides', 'Decisions and Verdicts']"
What’s Your Breastfeeding Story? We Want to Hear From You.,2022-08-08,article,News,,"['Breastfeeding', 'Parenting']"
Biden Is on a Roll That Any President Would Relish. Is It a Turning Point?,2022-08-08,article,News Analysis,,"['Inflation Reduction Act of 2022', 'Coronavirus (2019-nCoV)', 'United States Politics and Government']"
Michigan Officials Detail a Brazen Voting Machine Scheme by Trump Supporters,2022-08-08,article,News,,"['Project Democracy', 'Elections, Attorneys General', 'Presidential Election of 2020', 'Voter Fraud (Election Fraud)', 'Voting Machines', 'Conflicts of Interest', 'Special Prosecutors (Independent Counsel)', 'United States Politics and Government', 'Midterm Elections (2022)']"
"David McCullough, Best-Selling Explorer of America’s Past, Dies at 89",2022-08-08,article,Obituary (Obit),,"['Deaths (Obituaries)', 'Writing and Writers', 'Books and Literature', 'Presidents and Presidency (US)', 'Pulitzer Prizes']"
"Bert Fields, Lawyer to the Hollywood Elite, Dies at 93",2022-08-08,article,Obituary (Obit),,"['Suits and Litigation (Civil)', 'Legal Profession', 'Deaths (Obituaries)', 'Movies', 'Celebrities']"
"Electric Cars Too Costly for Many, Even With Aid in Climate Bill",2022-08-08,article,News,,"['Electric and Hybrid Vehicles', 'Batteries', 'Used Cars', 'Global Warming', 'Prices (Fares, Fees and Rates)', 'Inflation Reduction Act of 2022', 'Tax Credits, Deductions and Exemptions']"
"In Lawsuits, Ex-Employees Offer Harsh Portrait of Project Veritas",2022-08-08,article,News,,"['Suits and Litigation (Civil)', 'Workplace Hazards and Violations', 'News and News Media']"
"Chad’s Military Junta and Rebels Sign a Deal, but a Main Player Is Missing",2022-08-08,article,News,,"[""Coups D'Etat and Attempted Coups D'Etat"", 'International Relations', 'Elections', 'Politics and Government']"
Blinken says it will be ‘open season’ around the world if Russia’s aggression in Ukraine is not stopped.,2022-08-08,article,News,,[]
The Perfect S’more Is Practically Burned and a Little Salty,2022-08-08,article,News,,"['Cooking and Cookbooks', 'Chocolate', 'Recipes', 'Camps and Camping']"
Investigators Say Collector Had Suspect Art and Lots of Chutzpah,2022-08-08,article,News,,"['Arts and Antiquities Looting', 'Suits and Litigation (Civil)', 'Smuggling', 'Art']"
Beyoncé’s ‘Renaissance’ Dominates the Album and Singles Charts,2022-08-08,article,News,,"['Pop and Rock Music', 'Rhythm and Blues (Music)']"
"A Climate Bill, No Thanks to the G.O.P.",2022-08-08,article,Letter,,"['Global Warming', 'United States Politics and Government', 'Law and Legislation', 'Inflation Reduction Act of 2022', 'Nuclear Energy', 'Homeless Persons']"
Scenes From the Chess Olympiad: Magnus Carlsen Is Still on Top of His Game,2022-08-08,article,News,,"['Chess', 'Chess Olympiad']"
How New York City Got Its Fresh Water,2022-08-08,article,Review,,"['Books and Literature', 'Reservoirs', 'Water']"
Blinken Details Push to Bolster Democracy in Africa,2022-08-08,multimedia,Video,,['Democracy (Theory and Philosophy)']
"Another Gaza Conflict, but With a Difference: Hamas Sat It Out.",2022-08-08,article,News,,"['Palestinians', 'War and Armed Conflicts', 'Defense and Military Forces', 'Muslims and Islam', 'Terrorism']"
"In war-battered Mykolaiv, the authorities search for informers helping the Russians.",2022-08-08,article,News,,"['Russian Invasion of Ukraine (2022)', 'Informers']"
‘The Devil Wears Prada’ Review: An Adaptation That Needs Tailoring,2022-08-08,article,Review,,['Theater']
Treasury Dept. blacklists crypto platform used in money laundering.,2022-08-08,article,News,,"['United States Economy', 'Virtual Currency', 'Money Laundering', 'Blacklisting', 'Cyberattacks and Hackers', 'Currency', 'Computers and the Internet']"
"In War-Torn Mykolaiv, Ukrainians Search for Informers",2022-08-08,article,News,,"['Russian Invasion of Ukraine (2022)', 'War and Armed Conflicts', 'International Relations']"
Teenage Mutant Ninja Turtles History (in a Half-Shell),2022-08-08,article,News,,"['Movies', 'Television']"
Do Spiders Dream of Eight-Legged Sheep?,2022-08-08,article,News,,"['Spiders', 'Dreams', 'Sleep', 'Brain', 'Research', 'your-feed-science']"
"At Mostly Mozart Concerts, Casual Vibes and High Musical Values",2022-08-08,article,News,,['Classical Music']
An Argument for Calling Your Mother,2022-08-08,article,Review,,"['Books and Literature', 'Parenting', 'Women and Girls']"
The U.S. Will Send Another $1 Billion in Aid to Ukraine.,2022-08-08,article,News,,"['Russian Invasion of Ukraine (2022)', 'Foreign Aid']"
"Olivia Newton-John, Pop Singer and ‘Grease’ Star, Dies at 73",2022-08-08,article,Obituary (Obit),,"['Pop and Rock Music', 'Deaths (Obituaries)', 'Movies']"
A Chaotic Sprint to the Finish for the W.N.B.A. Season,2022-08-08,article,News,,"['Basketball', 'Playoff Games']"
Strip-Searches of Children by London Police Are Called ‘Deeply Concerning’,2022-08-08,article,News,,"['Police Brutality, Misconduct and Shootings', 'Search and Seizure', 'Children and Childhood', 'Racial Profiling', 'Black People', 'Blacks']"
U.S. Promotes Democracy in Africa as Rival Nations Expand Influence,2022-08-08,article,News,,"['United States International Relations', 'Russian Invasion of Ukraine (2022)', 'Terrorism']"
Your Tuesday Briefing: China’s New Military Drills Near Taiwan,2022-08-08,article,briefing,,"['International Relations', 'Russian Invasion of Ukraine (2022)', 'Spotted Lanternflies']"
"‘Cheers, Virginia!’ Takes a Boozy Tour Through History",2022-08-08,article,News,,"['Museums', 'Alcoholic Beverages']"
The Guessing Game on the Front,2022-08-08,article,News,,"['Russian Invasion of Ukraine (2022)', 'War and Armed Conflicts', 'Museums', 'Culture (Arts)']"
A Choice of Mooncakes for the Mid-Autumn Festival,2022-08-08,article,News,,['Bakeries and Baked Products']
"‘Tito’s in a Can,’ Just Add Vodka",2022-08-08,article,News,,"['Vodka', 'Philanthropy']"
An Italian Newcomer for Murray’s Cheese Shop,2022-08-08,article,News,,['Cheese']
Follow the Scent of Cardamom to Smor Bakery,2022-08-08,article,News,,['Bakeries and Baked Products']
Anne Saxelby Remembered With a Legacy Fund,2022-08-08,article,News,,"['Cheese', 'Agriculture and Farming']"
It’s Never Too Late to Take Up Water Polo,2022-08-08,article,News,,"['Water Polo', 'Age, Chronological', 'Content Type: Personal Profile']"
"A Health Care Bill, Minus Covid",2022-08-08,article,News,,['Coronavirus (2019-nCoV)']
How Are You Feeling About Back-to-School This Year?,2022-08-08,article,News,,['internal-open-access']
Alex Jones’s Text Messages Turned Over to House Jan. 6 Committee,2022-08-08,article,News,,"['Storming of the US Capitol (Jan, 2021)', 'United States Politics and Government', 'Text Messaging']"
Biden Promises Federal Aid to Rebuild After Flooding in Kentucky,2022-08-08,multimedia,Video,,"['Floods', 'Federal Aid (US)', 'United States Politics and Government']"
Your Monday Evening Briefing,2022-08-08,article,briefing,,[]
Biden Tours ‘Heartbreaking’ Kentucky Flood Damage,2022-08-08,article,News,,"['Floods', 'United States Politics and Government']"
Ukraine Disowns an Olympic Champion Who Skated in Russia,2022-08-08,article,News,,"['Figure Skating', 'Russian Invasion of Ukraine (2022)']"
U.S. Returns 30 Looted Antiquities to Cambodia,2022-08-08,article,News,,"['Arts and Antiquities Looting', 'Museums', 'Collectors and Collections', 'United States International Relations']"
How a Last-Minute Lobbying Blitz Watered Down a Climate Bill Tax,2022-08-08,article,News,,"['Inflation Reduction Act of 2022', 'Private Equity', 'Tax Credits, Deductions and Exemptions', 'Capital Gains Tax', 'Hedge Funds', 'Corporate Taxes', 'United States Politics and Government']"
Did Democrats Just Save Civilization?,2022-08-08,article,Op-Ed,,"['Inflation Reduction Act of 2022', 'Global Warming', 'Alternative and Renewable Energy', 'Tax Credits, Deductions and Exemptions', 'Federal Budget (US)', 'United States Politics and Government']"
When Sexual Liberation Is Oppressive,2022-08-08,article,Op-Ed,,"['Books and Literature', 'Women and Girls', 'Sex', 'Content Type: Personal Profile']"
Why the Soothsayers Are So Puzzled by This Year’s Midterms,2022-08-08,article,News,,"['United States Politics and Government', 'internal-sub-only-nl', 'Midterm Elections (2022)', 'Elections, Senate', 'Elections, House of Representatives', 'Polls and Public Opinion']"
"In a Summer of Feints, Russia and Ukraine Try to Predict Enemy’s Next Move",2022-08-08,article,News,,"['Russian Invasion of Ukraine (2022)', 'Defense and Military Forces', 'United States International Relations']"
"F.B.I. Searches Trump’s Florida Home, Signaling Escalation of Inquiries",2022-08-08,article,News,,"['United States Politics and Government', 'Search and Seizure', 'Classified Information and State Secrets', 'Archives and Records']"
The search came as Trump is weighing another run for the presidency.,2022-08-09,article,News,,[]
G.O.P. Group Targets Herschel Walker With Ad on Domestic Abuse Accusations,2022-08-09,article,News,,"['United States Politics and Government', 'Elections, Senate', 'Political Advertising', 'Midterm Elections (2022)']"
From the archives: A look at the inquiry that led to the F.B.I. search of Trump’s Florida home.,2022-08-09,article,News,,[]
What is a federal search warrant?,2022-08-09,article,News,,['Search and Seizure']
Maryland Towns to Pay $5 Million in Black Teen’s Death in Police Encounter,2022-08-09,article,News,,"['Police Brutality, Misconduct and Shootings', 'Police']"
A Florida political website lands a scoop.,2022-08-09,article,News,,[]
U.S. Moves to Stretch Out Monkeypox Vaccine Supply,2022-08-09,article,News,,"['Monkeypox', 'Vaccination and Immunization', 'United States Politics and Government']"
I Get Up and Nothin' Gets Me Down,2022-08-09,article,News,,['Crossword Puzzles']
"‘Better Call Saul’ Season 6, Episode 12 Recap: Hit the Road",2022-08-09,article,Review,,['Television']
Nets Owner Backs Team Leaders Amid Durant’s Reported Ultimatum,2022-08-09,article,News,,"['Basketball', 'Trades (Sports)']"
"Heavy Rain Floods Streets in South Korea, Leaving Several Dead",2022-08-09,multimedia,Video,,"['Floods', 'Rain', 'Deaths (Fatalities)']"
Republican officials reacted with fury to news of the search.,2022-08-09,article,News,,[]
The House Jan. 6 panel is scheduled to interview Pompeo and Mastriano on Tuesday.,2022-08-09,article,News,,[]
Republican governors criticize the Mar-a-Lago search as ‘unprecedented’ and ‘un-American.’,2022-08-09,article,News,,['Governors (US)']
Law Enforcement Personnel Outside Trump’s Florida Residence,2022-08-09,multimedia,Video,,['United States Politics and Government']
"Record-Setting Rainfall Inundates Seoul, Killing at Least 9",2022-08-09,article,News,,"['Floods', 'Rain']"
"For Ukrainians Abroad, War Has Also Meant a Flowering of Identity",2022-08-09,article,News,,"['War and Armed Conflicts', 'International Relations', 'Russian Invasion of Ukraine (2022)', 'Politics and Government', 'Migrant Labor (Non-Agriculture)', 'Discrimination', 'Economic Conditions and Trends', 'Labor and Jobs']"
Snapchat Introduces Its First Parental Controls,2022-08-09,article,News,,"['Instant Messaging', 'Mobile Applications', 'Children and Childhood', 'Parenting', 'Social Media', 'Computers and the Internet', 'Consumer Protection']"
A Dry Summer Doesn’t Mean Serious Drought in New York,2022-08-09,article,briefing,,"['Hurricanes and Tropical Storms', 'Infrastructure (Public Works)', 'Weather', 'Rain', 'Summer (Season)']"
"Quotation of the Day: ‘We Have Reached a Situation of Parity’ in the East, Ukraine Says",2022-08-09,article,Quote,,[]
"Corrections: Aug. 9, 2022",2022-08-09,article,News,,[]
"After being trapped for months, ships loaded with grain have left Ukraine. Where are they going?",2022-08-09,article,News,,"['Russian Invasion of Ukraine (2022)', 'Famine']"
Why China’s People No Longer Look Up to America,2022-08-09,article,Op-Ed,,"['United States International Relations', 'United States Politics and Government', 'Polls and Public Opinion']"
Your Tuesday Briefing,2022-08-09,article,briefing,,"['United States International Relations', 'Elections', 'War and Armed Conflicts', 'Russian Invasion of Ukraine (2022)', 'United States Politics and Government']"
A View From China on How Perceptions of America Have Changed,2022-08-09,article,Op-Ed,,"['United States International Relations', 'United States Politics and Government', 'Territorial Disputes']"
Will the fifth time be the charm for Raila Odinga?,2022-08-09,article,News,,['Elections']
"William Ruto, the self-proclaimed champion of Kenya’s ‘hustler nation’",2022-08-09,article,News,,"['Elections', 'Politics and Government']"
Stephen Colbert Taunts Trump for Bad Bathroom Behavior,2022-08-09,article,News,,"['internal-sub-only', 'Television', 'Bathrooms and Toilets']"
Here’s how Kenyan elections work.,2022-08-09,article,News,,['Elections']
Unai Emery Is Back for More,2022-08-09,article,News,,"['Soccer', 'UEFA Champions League (Soccer)', 'UEFA Europa League', 'Content Type: Personal Profile', 'Coaches and Managers']"
Spelling Bee Forum,2022-08-09,article,News,,[]
"The Long, Long Wait for a Diabetes Cure",2022-08-09,article,News,,"['Diabetes', 'Clinical Trials', 'Drugs (Pharmaceuticals)', 'Documentary Films and Programs', 'Insulin', 'Research', 'Content Type: Personal Profile']"
Anxious New Yorkers Worry Whether Eric Adams Is the Man for the Moment,2022-08-09,article,News,,"['Politics and Government', 'Polls and Public Opinion', 'Homeless Persons', 'Education (K-12)', 'Crime and Criminals']"
The troubles of Kenya’s China-funded train.,2022-08-09,article,News,,[]
How to Fall Out of Love With Your Lawn,2022-08-09,multimedia,Video,,"['Lawns', 'Content Type: Service', 'Global Warming', 'Drought', 'your-feed-opinionvideo']"
That Dinner Tab Has Soared. Here Are All the Reasons.,2022-08-09,multimedia,Interactive Feature,,"['Restaurants', 'Inflation (Economics)', 'Prices (Fares, Fees and Rates)', 'United States Economy', 'Food', 'Labor and Jobs', 'Shortages', 'Oil (Petroleum) and Gasoline', 'Wages and Salaries']"
How Russia Took Over Ukraine’s Internet in Occupied Territories,2022-08-09,multimedia,Interactive Feature,,"['Russian Invasion of Ukraine (2022)', 'Computers and the Internet', 'Censorship', 'Surveillance of Citizens by Government']"
Want to Stay Cool? Try Ankara Hand Fans.,2022-08-09,article,News,,"['NIGERIAN-AMERICANS', 'Fans (Airflow)', 'Fashion and Apparel']"
Three Sentences That Could Change the World — and Your Life,2022-08-09,article,Op-Ed,,"['audio-neutral-informative', 'Philosophy', 'Philanthropy', 'Ethics (Personal)']"
New York’s Hottest Club Is the Catholic Church,2022-08-09,article,Op-Ed,,"['Christians and Christianity', 'Generation Z']"
The Cruelty Is Coming From Inside the House,2022-08-09,article,Review,,['Books and Literature']
